<?xml version="1.0" encoding="UTF-8" standalone="no"?>
<?xml-stylesheet type="text/xsl" href="fin.xslt"?>
<library xmlns:xsi="http://www.w3.org/2001/XMLSchema-instance"
    xsi:noNamespaceSchemaLocation="games.xsd">
    <name>Games in the Library</name>
    <game>
        <title>Elden Ring</title>
        <publisher>FromSoftware Inc.</publisher>
        <releaseDate>2022-02-24</releaseDate>
        <genre>Action/RPG</genre>
        <value>$59.99</value>
    </game>
    <game>
        <title>Borderlands</title>
        <publisher>2K</publisher>
        <releaseDate>2009-10-20</releaseDate>
        <genre>Action/RPG</genre>
        <value>$29.99</value>
    </game>
    <game>
        <title>Risk of Rain 2</title>
        <publisher>Gearbox Publishing</publisher>
        <releaseDate>2020-08-11</releaseDate>
        <genre>Action/Indie</genre>
        <value>$24.99</value>
    </game>
    <game>
        <title>Hardspace: Shipbreaker</title>
        <publisher>Focus Entertainment</publisher>
        <releaseDate>2020-06-16</releaseDate>
        <genre>Simulation</genre>
        <value>$34.99</value>
    </game>
    <game>
        <title>Stardew Valley</title>
        <publisher>ConcernedApe</publisher>
        <releaseDate>2016-02-26</releaseDate>
        <genre>Indie/RPG/Simulation</genre>
        <value>$15.99</value>
    </game>
</library>
